Functietitel,Ervaring (Jaren),Vaardigheden,Opleiding,Locatie
Junior Software Engineer,1-2,"JavaScript, React, SQL, Git",Bachelor in Informatica of vergelijkbaar,Rotterdam
Senior Data Scientist,5+,"Python, Machine Learning, SQL, TensorFlow, R",Master in Data Science of vergelijkbaar,Amsterdam
Frontend Developer,2-4,"HTML, CSS, JavaScript, React, Vue.js",Bachelor in Web Development of vergelijkbaar,Utrecht
DevOps Engineer,3-5,"Docker, Kubernetes, AWS, CI/CD, Linux",Bachelor in Informatietechnologie of vergelijkbaar,Eindhoven
Backend Developer,5+,"Java, Spring Boot, REST API, SQL, MongoDB",Bachelor in Computer Engineering of vergelijkbaar,Breda
